show_id,type,title,director,cast,country,date_added,release_year,rating,duration,listed_in,description
80128317,TV Show,The Eighties,,,United States,"September 30, 2018",2016,TV-PG,1 Season,Docuseries,"This nostalgic documentary series relives the 1980s from a variety of angles, exploring its impact on the politics, technology and culture of today."
81027384,TV Show,The Nineties,,,United States,"September 30, 2018",2017,TV-14,1 Season,Docuseries,This U.S.-focused series dives into the cultural and political changes that swept the last decade of the 20th century. Executive produced by Tom Hanks.
80030186,TV Show,The Seventies,,,United States,"September 30, 2018",2015,TV-PG,1 Season,Docuseries,"This series examines 1970s America, focusing on the major political and historical landmarks of the decade and the cultural response to those events."
80116921,TV Show,We Bare Bears,,"Eric Edelstein, Demetri Martin, Bobby Moynihan",United States,"September 30, 2018",2017,TV-Y7,1 Season,"Kids' TV, TV Comedies","Grizzly, Panda and Ice Bear are three adopted bear brothers struggling against their animal instincts to fit into the civilized, modern human world."
80187061,Movie,The Mayor,Park In-je,"Min-sik Choi, Do-won Kwak, Eun-kyung Shim, So-ri Moon, Mi-ran Ra, Hye-young Ryu, Ki Hong Lee, Sun-gyu Jin, Joo-yeon Lee, Byeong-eun Park",South Korea,"September 30, 2017",2017,TV-MA,130 min,"Dramas, International Movies","With the presidency in mind, the incumbent mayor of Seoul runs for an unprecedented third term – and will stop at nothing to keep his secrets hidden."
80181555,TV Show,The Royal House of Windsor,,,United Kingdom,"September 30, 2017",2017,TV-14,1 Season,"British TV Shows, Docuseries, International TV Shows","Drawing on newly available info, this show traces how the British royal family has survived the last 100 years of power struggles, politics and more."
80081155,Movie,Amanda Knox,"Rod Blackhurst, Brian McGinn",,"Denmark, United States","September 30, 2016",2016,TV-MA,92 min,Documentaries,She was twice convicted and acquitted of murder. Amanda Knox and the people closest to her case speak out in this illuminating documentary.
80184358,TV Show,Lovesick,,"Kongyingyong Chonlathorn, Phumphothingam Nawat, Luangsodsai Anupart, Nuchanart Veerakaarn, Chindavanich Primrose, Charnmanoon Pannin, Nungira Hanwutinanon, Ausavaterakul Ausavapat, Sirikiet Saejea, Nontapan Chuenwarin",,"September 3, 2018",2014,TV-14,1 Season,"International TV Shows, Romantic TV Shows, TV Dramas",Love and academics get complicated at an all-male college that happens to be located next to an all-female high school.
80198585,Movie,The Debt Collector,Jesse V. Johnson,"Scott Adkins, Louis Mandylor, Vladimir Kulich, Michael Paré, Rachel Brann, Selina Lo, Tony Todd","United Kingdom, United States","September 3, 2018",2018,TV-MA,96 min,Action & Adventure,"A broke martial arts instructor takes a side gig with a mobster, who pairs him with a veteran thug for a weekend of fisticuffs-fueled debt collection."
70233894,Movie,Act of Vengeance,Mahsun Kırmızıgül,"Haluk Bilginer, Mahsun Kırmızıgül, Mustafa Sandal, Gina Gershon, Robert Patrick, Danny Glover, Engin Altan Düzyatan, Scott William Winters, Sharrieff Pugh","Turkey, United States","September 29, 2018",2010,NR,112 min,"Action & Adventure, International Movies","Two Turkish agents are sent to New York City on a mission to capture a notorious terrorist known only as ""Dejjal"" (Arabic for Antichrist)."
81011955,Movie,Paradise Lost,Monique Gardenberg,"Júlio Andrade, Lee Taylor, Hermila Guedes, Julia Konrad, Erasmo Carlos, Marjorie Estiano, Seu Jorge, Jaloo, Felipe Abib, Humberto Carrão, Malu Galli",Brazil,"September 29, 2018",2018,TV-MA,111 min,"Dramas, Independent Movies, International Movies","A cop moonlights as the bodyguard for a young drag queen at a nightclub, and grows closer to the family of misfit singers that perform there."
80128722,Movie,Gerald's Game,Mike Flanagan,"Carla Gugino, Bruce Greenwood, Henry Thomas, Carel Struycken, Chiara Aurelia",United States,"September 29, 2017",2017,TV-MA,103 min,"Horror Movies, Thrillers","When her husband's sex game goes wrong, Jessie – handcuffed to a bed in a remote lake house – faces warped visions, dark secrets and a dire choice."
80182115,Movie,Long Shot,Jacob LaMendola,,United States,"September 29, 2017",2017,TV-14,40 min,Documentaries,"When Juan Catalan is arrested for a murder he didn't commit, he builds his case for innocence around raw footage from a popular TV show. A documentary."
80163293,TV Show,Mak Cun,,"Erma Fatima, Rahim Razali, Umie Aida, Nora Danish",,"September 29, 2017",2015,TV-PG,1 Season,"International TV Shows, TV Comedies, TV Dramas",A woman with an entrepreneurial spirit takes life into her own hands by starting a beauty cream business that inspires other women to take chances.
80104068,Movie,Our Souls at Night,Ritesh Batra,"Robert Redford, Jane Fonda, Bruce Dern, Matthias Schoenaerts, Iain Armitage, Judy Greer, Phyllis Somerville",United States,"September 29, 2017",2017,TV-14,103 min,"Dramas, Romantic Movies","After widowed neighbors Addie and Louis begin sleeping in bed together platonically to alleviate their loneliness, a real romance begins to blossom."
80119349,Movie,Out of Thin Air,Dylan Howitt,,,"September 29, 2017",2017,TV-14,85 min,"Documentaries, International Movies","Picking up 40 years after six were convicted for two strange murders in Iceland, this chilling documentary proves confessions can’t always be trusted."
80199032,TV Show,Paul Hollywood's Big Continental Road Trip,,Paul Hollywood,United Kingdom,"September 29, 2017",2017,TV-14,1 Season,"British TV Shows, Docuseries, International TV Shows","Gear up for a fast-paced journey as celebrity chef and avid auto enthusiast Paul Hollywood takes in the cars and culture of France, Italy and Germany."
80180449,TV Show,Satu Hari,,"Sara Ali, Remy Ishak, Rita Rudaini, Mirza Salihovic, Hafizul Kamal, Miller Khan",,"September 29, 2017",2014,TV-14,1 Season,"International TV Shows, TV Dramas","A man haunted by his wife's affair moves to Sarajevo and starts to love again, until fate forces him to choose between his new life and old loyalty."
80019931,Movie,"Monster High: Boo York, Boo York",William Lau,"Karen Strassman, Celeste Henderson, Wendee Lee, TJ Smith, America Young, Rachel Staman, Laura Bailey",United States,"September 29, 2015",2015,TV-Y7,72 min,"Children & Family Movies, Music & Musicals",Cleo is invited to a gala in the big city celebrating a magical comet and brings her best friends along. But the sinister Nefera has other plans.
81053893,Movie,Cultivating the Seas: History and Future of the Full-Cycle Cultured Kindai Tuna,Mana Yasuda,,,"September 28, 2019",2019,TV-G,45 min,"Documentaries, International Movies",An in-depth look at the full-cycle breeding program for bluefin Kindai tuna pioneered by Kinki University’s Aqua Culture Research Institute.
80200087,Movie,Domino,Brian De Palma,"Nikolaj Coster-Waldau, Carice van Houten, Eriq Ebouaney, Guy Pearce, Mohammed Azaay, Søren Malling, Paprika Steen, Helena Kaittani","Denmark, France, Italy, Belgium, Netherlands","September 28, 2019",2019,R,89 min,"International Movies, Thrillers","A Copenhagen police officer hunts for the man who attacked his partner, only to stumble into a high-stakes game of espionage."
81053892,Movie,TUNA GIRL,Mana Yasuda,"Fuka Koshiba, Tom Fujita, Hidetoshi Hoshida, Hiroto Kanai, Ryosuke Yusa, Shuri Tanaka, Chal Inoue, Takashi Taniguchi, Takeshi Masu",,"September 28, 2019",2019,TV-PG,90 min,"Dramas, International Movies",A clumsy but cheerful fisheries student struggles to find her place at a research institute renowned for its tuna cultivation. The work isn't easy.
81002850,Movie,5CM,Rizal Mantovani,"Herjunot Ali, Raline Shah, Fedi Nuril, Pevita Pearce, Saykoji, Denny Sumargo, Didi Petet, Firrina Sinatrya",Indonesia,"September 28, 2018",2012,TV-14,126 min,"Dramas, International Movies","Five friends embark on a mission to climb the highest peak in Java, overcoming obstacles on the way and discovering the true meaning of friendship."
81004470,Movie,Animal World,Han Yan,"Li Yi Feng, Zhou Dongyu, Michael Douglas, Bingkun Cao, Ge Wang, Keanu Chi, Zhang Jungyi, Yijuan Li, Su Ke",China,"September 28, 2018",2018,TV-MA,130 min,"Action & Adventure, International Movies, Sci-Fi & Fantasy","An unlucky, debt-ridden teen resorts to his math skills when he's forced into a deadly tournament of rock-paper-scissors run by a diabolical host."
80157072,Movie,Hold the Dark,Jeremy Saulnier,"Jeffrey Wright, Alexander Skarsgård, James Badge Dale, Riley Keough, Julian Black Antelope, Tantoo Cardinal, Macon Blair, Jonathan Whitesell, Peter McRobbie",United States,"September 28, 2018",2018,TV-MA,126 min,"Action & Adventure, Dramas","In the grim Alaskan winter, a naturalist hunts for wolves blamed for killing a local boy, but he soon finds himself swept into a chilling mystery."
81001809,Movie,Lessons from a School Shooting: Notes from Dunblane,Kim A. Snyder,,United States,"September 28, 2018",2018,TV-PG,24 min,Documentaries,"Two priests – one from Dunblane, Scotland, the other from Newtown, Connecticut – bond over school tragedies that occurred 16 years apart."
80201933,TV Show,Made in Mexico,,,United States,"September 28, 2018",2018,TV-MA,1 Season,"International TV Shows, Reality TV, Spanish-Language TV Shows","These Mexico City socialites may lead opulent lives, but a peek behind the curtain reveals a tangled web of intrigue, envy and personal struggles."
81002864,Movie,Single,Raditya Dika,"Raditya Dika, Annisa Rawles, Chandra Liow, Pandji Pragiwaksono, Babe Cabita, Elvira Devinamira, Tinna Harahap, Pevita Pearce, Rinna Hassim, Dede Yusuf, Dewi Hughes",Indonesia,"September 28, 2018",2015,TV-PG,127 min,"Comedies, International Movies, Romantic Movies","Unemployed and immature, a somewhat pathetic bachelor sets his sights on finding a date for the wedding of his younger, more successful brother."
81016750,Movie,The 3rd Eye,Rocky Soraya,"Jessica Mila, Denny Sumargo, Citra Prima, Bianca Hello, Epy Kusnandar, Anita Hara, Derry Drajat, Voke Victoria, Shofia Shireen, Afdhal Yusman",Indonesia,"September 28, 2018",2018,TV-MA,108 min,"Horror Movies, International Movies","When her little sister claims she sees the dead, Alia consults a psychic, who opens her own eyes to the vengeful ghosts haunting their childhood home."
81002866,Movie,The Sinking Of Van Der Wijck,Sunil Soraya,"Herjunot Ali, Pevita Pearce, Reza Rahadian, Randy Nidji, Gesya Shandy, Kevin Andrean, Arzetti Bilbina",Indonesia,"September 28, 2018",2013,TV-14,163 min,"Dramas, International Movies, Romantic Movies","When a young man leaves home to fulfill the wishes of his late father, he meets and falls in love with a woman from a very different background."
80992039,Movie,Two Catalonias,"Álvaro Longoria, Gerardo Olivares",,Spain,"September 28, 2018",2018,TV-MA,117 min,"Documentaries, International Movies",Lawmakers and activists with conflicting ideologies speak about the complexities of Catalonia's politics and the fight for its independence from Spain.
80126507,Movie,Bobby Sands: 66 Days,Brendan Byrne,,"Ireland, United Kingdom","September 28, 2017",2016,TV-14,106 min,Documentaries,"In 1981, an imprisoned Irish Republican Army soldier went on a hunger strike that galvanized his movement and made him a controversial global icon."
